{
  "authorization_tier": 1,
  "cert_type": "AFSP_TIER_KEY_CERTIFICATE",
  "consumer_device_id": "dev_9f3a1c2e4b5d6f7a8b9c0d1e2f3a4b5c",
  "eku": [
    "READ",
    "DISCOVER",
    "PRESENT"
  ],
  "hardware_bound": true,
  "issuer_institution_id": "harbor_federal_afsp_001",
  "issuer_signature": {
    "algorithm": "ECDSA-P256",
    "signature": "MEUCIQCj7o8VzN12AlFxpXA//YqiK7Wf6uM613N52LmeZc1ffQIgFmkdl+XURTuDl+VUTYVudrDPtbVei+rw/GtUlbsTmtc=",
    "signed_by": "harbor_federal_signing_key_2026"
  },
  "not_after": "2027-03-02T09:00:00Z",
  "not_before": "2026-03-02T09:00:00Z",
  "public_key": {
    "crv": "P-256",
    "kty": "EC",
    "x": "r0R47qQ8JFvS-CDNMktutqh3WosrRjB_-RwG83eEjD8",
    "y": "eDk6LfmwuZ4s7xWbPYYmg4jlZmg7Qxlx3iho34eTX-4"
  },
  "root_key_thumbprint": "pRsqMiP5GSIJbvBfRJKpgfqiJDZ3eUD0TKhqLhddvhE",
  "tee_attestation_verified": true,
  "version": "0.1"
}
