{
  "authorization_tier": 2,
  "cert_type": "AFSP_TIER_KEY_CERTIFICATE",
  "consumer_device_id": "dev_9f3a1c2e4b5d6f7a8b9c0d1e2f3a4b5c",
  "eku": [
    "INITIATE"
  ],
  "hardware_bound": true,
  "issuer_institution_id": "harbor_federal_afsp_001",
  "issuer_signature": {
    "algorithm": "ECDSA-P256",
    "signature": "MEUCIQCWlwfeBh2nM4irUetxPirUcCOMX/TKkccKjAnFFWDbjgIgVK3XfIVzk2rfWw8LqP/1nwXgOsXkDGG2nXzXuisoqKM=",
    "signed_by": "harbor_federal_signing_key_2026"
  },
  "not_after": "2027-03-02T09:00:00Z",
  "not_before": "2026-03-02T09:00:00Z",
  "public_key": {
    "crv": "P-256",
    "kty": "EC",
    "x": "RMDBxWeWgH7coPwlrf4f1sx8DkOuAnmFog7Zs5rR4PM",
    "y": "N9ZZq_50HuLd7Fok5ZyJZadRmTA1LGAKiN-EK5WmNuk"
  },
  "root_key_thumbprint": "pRsqMiP5GSIJbvBfRJKpgfqiJDZ3eUD0TKhqLhddvhE",
  "tee_attestation_verified": true,
  "version": "0.1"
}
